{
  "generated_at": "2026-09-29T23:44:39Z",
  "provider": "data.go.kr",
  "registry": "/home/runner/work/datapan-registry/datapan-registry/data/data-go-kr.registry.json",
  "limit": 0,
  "truncated": false,
  "filtered_count": 11,
  "summary": {
    "target_hosts": 11,
    "target_operations": 29,
    "external_endpoint_operations": 29,
    "service_root_operations": 0,
    "approval_required_operations": 0,
    "missing_param_operations": 21,
    "unsupported_protocol_operations": 0
  },
  "targets": [
    {
      "rank": 1,
      "host": "openapi.coast.kr",
      "kinds": [
        "external_endpoint"
      ],
      "operations": 6,
      "specs": 1,
      "organizations": [
        "해양수산부"
      ],
      "source_categories": [
        "농축수산"
      ],
      "api_types": [
        "REST"
      ],
      "data_formats": [
        "XML"
      ],
      "sample_operations": [
        {
          "dataset_id": "15059302",
          "title": "연안정보도 도엽제공 서비스",
          "organization": "해양수산부",
          "operation": "연안정보도 1:25000 축척 도엽 다운로드 정보 현황",
          "dependency_class": "external_endpoint",
          "endpoint": "http://openapi.coast.kr/openapi/service/coastSpatialDataService"
        },
        {
          "dataset_id": "15059302",
          "title": "연안정보도 도엽제공 서비스",
          "organization": "해양수산부",
          "operation": "연안정보도 1:25000 축척 도엽 상세정보 현황",
          "dependency_class": "external_endpoint",
          "endpoint": "http://openapi.coast.kr/openapi/service/coastSpatialDataService"
        },
        {
          "dataset_id": "15059302",
          "title": "연안정보도 도엽제공 서비스",
          "organization": "해양수산부",
          "operation": "연안정보도 1:25000 축척 도엽정보 리스트 정보 현황",
          "dependency_class": "external_endpoint",
          "endpoint": "http://openapi.coast.kr/openapi/service/coastSpatialDataService"
        }
      ]
    },
    {
      "rank": 2,
      "host": "www.rda.go.kr",
      "kinds": [
        "external_endpoint"
      ],
      "operations": 4,
      "specs": 2,
      "organizations": [
        "농촌진흥청"
      ],
      "source_categories": [
        "농축수산"
      ],
      "api_types": [
        "REST"
      ],
      "data_formats": [
        "XML"
      ],
      "missing_param_operations": 4,
      "sample_operations": [
        {
          "dataset_id": "15002002",
          "title": "농촌진흥청_농업기계 안전정보",
          "organization": "농촌진흥청",
          "operation": "농기계안전정보 목록 조회",
          "dependency_class": "external_endpoint",
          "endpoint": "http://www.rda.go.kr/openapidata/service/rdamachinesafe_api",
          "missing_params": [
            "searchtype",
            "searchword"
          ]
        },
        {
          "dataset_id": "15002055",
          "title": "농촌진흥청_농업농촌종합정보(인테러뱅)",
          "organization": "농촌진흥청",
          "operation": "농업농촌종합정보(인테러뱅) 댓글보기 조회",
          "dependency_class": "external_endpoint",
          "endpoint": "http://www.rda.go.kr/openapidata/service/interrobang_api",
          "missing_params": [
            "seq"
          ]
        },
        {
          "dataset_id": "15002055",
          "title": "농촌진흥청_농업농촌종합정보(인테러뱅)",
          "organization": "농촌진흥청",
          "operation": "농업농촌종합정보(인테러뱅) 목록 조회",
          "dependency_class": "external_endpoint",
          "endpoint": "http://www.rda.go.kr/openapidata/service/interrobang_api",
          "missing_params": [
            "searchtype",
            "searchword"
          ]
        }
      ]
    },
    {
      "rank": 3,
      "host": "car.daegu.go.kr",
      "kinds": [
        "external_endpoint"
      ],
      "operations": 4,
      "specs": 1,
      "organizations": [
        "대구광역시"
      ],
      "source_categories": [
        "교통물류"
      ],
      "api_types": [
        "REST"
      ],
      "data_formats": [
        "JSON"
      ],
      "missing_param_operations": 4,
      "sample_operations": [
        {
          "dataset_id": "15097855",
          "title": "대구광역시_어린이 보호구역 위험요소 조회 서비스",
          "organization": "대구광역시",
          "operation": "어린이 보호구역 내 고정체 위험요소 조회 서비스",
          "dependency_class": "external_endpoint",
          "endpoint": "http://car.daegu.go.kr/openapi-data/service/dgcshazards/getFixTotal",
          "missing_params": [
            "zoneNm",
            "gubun"
          ]
        },
        {
          "dataset_id": "15097855",
          "title": "대구광역시_어린이 보호구역 위험요소 조회 서비스",
          "organization": "대구광역시",
          "operation": "어린이 보호구역 내 시간별/구간별 고정체 위험요소 조회 서비스",
          "dependency_class": "external_endpoint",
          "endpoint": "http://car.daegu.go.kr/openapi-data/service/dgcshazards/getFix",
          "missing_params": [
            "zoneNm",
            "sectionClassifyNm"
          ]
        },
        {
          "dataset_id": "15097855",
          "title": "대구광역시_어린이 보호구역 위험요소 조회 서비스",
          "organization": "대구광역시",
          "operation": "어린이 보호구역 내 시간별/구간별 이동체 위험요소 조회 서비스",
          "dependency_class": "external_endpoint",
          "endpoint": "http://car.daegu.go.kr/openapi-data/service/dgcshazards/getMove",
          "missing_params": [
            "zoneNm",
            "sectionClassifyNm"
          ]
        }
      ]
    },
    {
      "rank": 4,
      "host": "openapi.price.go.kr",
      "kinds": [
        "external_endpoint"
      ],
      "operations": 4,
      "specs": 1,
      "organizations": [
        "한국소비자원"
      ],
      "source_categories": [
        "공공행정"
      ],
      "api_types": [
        "REST"
      ],
      "data_formats": [
        "XML"
      ],
      "missing_param_operations": 4,
      "sample_operations": [
        {
          "dataset_id": "3043385",
          "title": "한국소비자원_생필품 가격 정보",
          "organization": "한국소비자원",
          "operation": "상품정보 조회",
          "dependency_class": "external_endpoint",
          "endpoint": "http://openapi.price.go.kr/openApiImpl/ProductPriceInfoService",
          "missing_params": [
            "goodId"
          ]
        },
        {
          "dataset_id": "3043385",
          "title": "한국소비자원_생필품 가격 정보",
          "organization": "한국소비자원",
          "operation": "생필품 가격 정보 기준 데이터 조회",
          "dependency_class": "external_endpoint",
          "endpoint": "http://openapi.price.go.kr/openApiImpl/ProductPriceInfoService",
          "missing_params": [
            "classCode"
          ]
        },
        {
          "dataset_id": "3043385",
          "title": "한국소비자원_생필품 가격 정보",
          "organization": "한국소비자원",
          "operation": "생필품 가격 정보 조회",
          "dependency_class": "external_endpoint",
          "endpoint": "http://openapi.price.go.kr/openApiImpl/ProductPriceInfoService",
          "missing_params": [
            "goodInspectDay",
            "entpId",
            "goodId"
          ]
        }
      ]
    },
    {
      "rank": 5,
      "host": "its.gyeongju.go.kr:81",
      "kinds": [
        "external_endpoint"
      ],
      "operations": 3,
      "specs": 1,
      "organizations": [
        "경상북도 경주시"
      ],
      "source_categories": [
        "교통물류"
      ],
      "api_types": [
        "REST"
      ],
      "data_formats": [
        "XML"
      ],
      "missing_param_operations": 3,
      "sample_operations": [
        {
          "dataset_id": "15021579",
          "title": "경상북도 경주시_버스 관련 정보",
          "organization": "경상북도 경주시",
          "operation": "노선정보 조회",
          "dependency_class": "external_endpoint",
          "endpoint": "http://its.gyeongju.go.kr:81/bis/openapi/getRouteNoList.do",
          "missing_params": [
            "routeNo"
          ]
        },
        {
          "dataset_id": "15021579",
          "title": "경상북도 경주시_버스 관련 정보",
          "organization": "경상북도 경주시",
          "operation": "실시간 버스정보 조회",
          "dependency_class": "external_endpoint",
          "endpoint": "http://its.gyeongju.go.kr:81/bis/openapi/getRouteAcctoBusLcList.do",
          "missing_params": [
            "routeId"
          ]
        },
        {
          "dataset_id": "15021579",
          "title": "경상북도 경주시_버스 관련 정보",
          "organization": "경상북도 경주시",
          "operation": "정류장정보 조회",
          "dependency_class": "external_endpoint",
          "endpoint": "http://its.gyeongju.go.kr:81/bis/openapi/getSttnNoList.do",
          "missing_params": [
            "nodeNm"
          ]
        }
      ]
    },
    {
      "rank": 6,
      "host": "data.wanju.go.kr",
      "kinds": [
        "external_endpoint"
      ],
      "operations": 2,
      "specs": 2,
      "organizations": [
        "전북특별자치도 완주군"
      ],
      "source_categories": [
        "공공행정",
        "문화관광"
      ],
      "api_types": [
        "REST"
      ],
      "data_formats": [
        "JSON+XML"
      ],
      "missing_param_operations": 2,
      "sample_operations": [
        {
          "dataset_id": "15010208",
          "title": "전라북도 완주군_사회적기업 현황",
          "organization": "전북특별자치도 완주군",
          "operation": "사회적기업 정보",
          "dependency_class": "external_endpoint",
          "endpoint": "http://data.wanju.go.kr/rest/wanjusocial/getSocialInfo",
          "missing_params": [
            "sid",
            "dataValue",
            "dataName"
          ]
        },
        {
          "dataset_id": "15058097",
          "title": "전라북도 완주군_공연행사 정보 서비스",
          "organization": "전북특별자치도 완주군",
          "operation": "공연행사 정보",
          "dependency_class": "external_endpoint",
          "endpoint": "http://data.wanju.go.kr/rest/wanjuevent/getEvent",
          "missing_params": [
            "sid",
            "dataValue",
            "dataName"
          ]
        }
      ]
    },
    {
      "rank": 7,
      "host": "www.cid.or.kr",
      "kinds": [
        "external_endpoint"
      ],
      "operations": 2,
      "specs": 1,
      "organizations": [
        "건설근로자공제회"
      ],
      "source_categories": [
        "공공행정"
      ],
      "api_types": [
        "REST"
      ],
      "data_formats": [
        "JSON+XML"
      ],